Need help pleese,neutral
Register for premium pass,neutral
Apply for premium pass?,neutral
Register for meal pass.,neutral
How to apply?,question
Application process?,neutral
Registration method?,neutral
Process of application,neutral
How do I apply?,question
Give me the registration procedure,neutral
What form do i have to fill for enrolling into sodexo,neutral
How can i join sodexo?,question
How can i book my sodexo pass?,question
Can you guide me through your company's enrollment procedure,question
Sign up for sodexo pass/card,neutral
Apply for meal pass.,neutral
Registration process for meal pass?,question
Application process for meal pass?,question
How to apply/register?,question
What is the registration process?,question
How do i utilize serves provided by your company,question
Process of signing up for sodexo,neutral
Hw do i register?,question
Can i signup here?,question
Cn u hlp me with registration?,question
Where can I apply or register for a Sodexo card?,question
How to register?,question
Process of registering?,question
How do I apply for meal pass?,question
What is the application process?,question
Apply kaise kare?,neutral
Application method?,neutral
Time it takes to get the loan to be approved?,neutral
Time it will take to get a loan approval?,neutral
Time it will take to get a loan sanctioned?,neutral
Time needed for the loan approved?,neutral
Time needed for the loan granted?,neutral
Time need for the loan approval?,neutral
Time required for loan approval?,neutral
Why is this approval taking so much time?,question
What's the time you take for approving any loan,question
What's the time you need to sanction my loan,question
What's the time you need to approve my loan,question
What is the time duration for approval?,question
What is the approval time for this loan?,question
Where are you taking so time time for approval?,question
Too much time for approval,neutral
Time you need for giving me a loan granted?,neutral
Time you need for giving me a loan approved?,neutral
Time you'd take for process the loan sanction,neutral
For this loan what is the approval time?,neutral
How long does it take for a loan to be approved?,question
How long will it take to get the money after loan has been sanctioned?,question
How long will it time required after the loan has been granted?,question
How long will you take to give me loan amount after the loan has been approved?,question
How many days does loan approval take?,question
How many days will loan approval take?,question
How much time does it take for loan approval?,question
How much time for approval of loan?,question
How much time is needed for approval of loan?,question
How much time will be required for loan approval?,question
How much time will it take to approve my loan?,question
How much time will it take to sanction my loan?,question
how much time you are going to to take for approval of loan?,question
How much time you need to give me loan amount after the loan is approved?,question
How much time you need to give me money after the loan is approved?,question
In how many days after submitting is the loan approved?,question
In how many days is the the loan approved?,question
In how much time can you you give the loan,question
In how much time will I get loan after applying?,question
Loan approval is taking lot of time,neutral
Loan approval takes how much time?,neutral
Loan is approved in how many days?,neutral
The loan approval is going for a long time,neutral
Time for approval is very much,neutral
Time it takes to get the loan to be granted?,neutral
Time you need for approval,neutral
Time you'd take for process the loan approval,neutral
Time required for loan sanction process,neutral
Time required for loan approval process,neutral
After applying in how much time will I get loan?,question
After applying loan will get in how much time?,question
After loan application how much time required?,question
After the loan process how much time is required?,question
After the process how much time needed?,question
Already applied in how much time will I get loan?,question
Approval is taking very much time...,neutral
Approval time is too long.,neutral
Approval time is very much,neutral
For approval of loan how much time is required?,neutral
For getting this loan what is the time required for approval?,neutral
For loan approval how much time will be required?,neutral
for loan what is the approval time?,neutral
For long time loan approval is going on,neutral
you cannot help me,neutral
I don't get response,neutral
Really bad support,neutral
No response from your side,neutral
Have not recieved responses,neutral
Do not recieved any response from you guys,neutral
You don't respond to my emails,neutral
You guys have a really bad service,neutral
No response of my emails,neutral
You have not responded to my email queries,neutral
abcd company has a bad support,neutral
You have a bad support,neutral
You really have a bad service,neutral
Bad service you have,neutral
I cannot find my current bank in net banking option,neutral
In net banking option I cannot find my bank,neutral
In net banking option I cannot find my current bank,neutral
My bank is not available in net banking option,neutral
My bank is not present in net banking choice,neutral
My bank is not present in net banking option,neutral
Bank is not there in banking options?,neutral
My bank is not supported,neutral
My bank is not there in options,neutral
My bank option is missing?,neutral
My current bank is not present in net banking option,neutral
Can you tell me why is my curent bank not present in net banking option?,neutral
My pank is missing from options?,neutral
No my bank is not present in the options,neutral
Why is my current bank not available in net banking option?,question
Why is my current bank not present in Net banking option?,question
Why is my current bank not present in online banking choice?,question
Why is my current bank not showing in the net banking option,question
Why si my bank not supported,question
Will I need an account of a specific bank for making the loan application?,question
Can you tell me why is my current bank not present in online banking choice?,question
Do I need to have an account of a certain bank for making the loan application because my bank is not avalable in net banking option,question
Do I need to have an account of a specific bank for making the loan application?,question
For making loan application do I need to have an account on a certain bank as my bank is not showing up in net banking option,question
For making loan application do I need to have an account on a specific bank?,question
For making loan application do I need to have an account on a specific bank because my bank is not present in net banking option,question
For the application of Loan will I have to make an account on a certain bank as in the net banking option my current bank is not available,question
Help me because I cannot find my bank in net banking option,neutral
Help me because I cannot find my current bank in net banking option,neutral
How should I proceed as I cannot find my bank in online banking choices?,question
I cannot find my bank in Net banking.,neutral
I cannot find my bank in net banking option,neutral
In net banking choice I cannot find my bank?,neutral
Bank is not there in the options,neutral
Bank not there on the options,neutral
cannot find my bank in net banking choice,neutral
Cannot find my bank in netbanking option,neutral
Bank is not supported by you,neutral
Bank is not present in the options,neutral
You do no support my bank,neutral
Would I need an account with a specific bank to make the loan application?,question
Will I need an account of a specific bank for making the loan application as I cannot find my current bank in net banking option?,question
Why is my bank not showing in the online banking choice?,question
Why is my bank not showing in the net banking option,question
Why is my bank not present in Net banking option?,question
Why is my bank is not present in net banking option?,question
Why is my bank is not present in net banking choices?,question
Why is my bank is not available in net banking option?,question
There is not my bank is net banking option?,neutral
There are Issues with net banking,neutral
Some Issues coming with net banking,neutral
Please tell me why is my current bank not present in net banking option?,question
Please tell me why is my curent bank not present in net banking option?,question
Please tell me why is my curent bank not available in net banking option?,question
What should I enter if my business category is not presented in the choices?,neutral
Cannot find Industry Type.,neutral
Cannot find Industry Type on the options.,neutral
Category I'm in is not present in the options,neutral
I cannot find my Business Category / Business Type in the options provided. What should I enter?,neutral
My business is not present on the category list,neutral
What should I enter if my business category is not presented in the options?,question
What should I enter if my business type is not presented in the options?,question
What to do as my business is not listed in the options?,question
What to do as my business is not listed on the categories?,question
What to do if my business category is not in the options?,question
What to enter if my my business category is not listed?,question
What to enter if my my business type is not listed?,question
Which option should I choose If my business category is not present?,question
Actually the business category I'm in is not present in the choices What should I do?,neutral
Actualy the business category I'm in is not present in the options What should I do?,neutral
if my business category is not present in the options,neutral
Industry Type is not there in the options.,neutral
In the business category my business is not listed What to do?,question
In the business type my business is not listed What to do?,question
In the options cannot find Industry Type.,question
In the options provided business category is not present What should I do?,question
My biz category is missing in the options What can I do?,question
My Business category is missing in the choices What can I do?,question
My Business category is missing in the options.,question
My Business category is missing in the options What can I do?,question
My business category is not there.,neutral
My business category missing from the options.,neutral
My business if different form the choices,neutral
My business is not listed in the options.,neutral
My business is not present on the category options.,neutral
My business is not there in category,neutral
My Business type is missing in the options What can I do?,question
The business I'm in is not there on the category list,neutral
What can I do even if my business category is not present in the choices?,question
What can I do even if my business category is not present in the options?,question
What should I enter if my biz type is not presented in the options?,question
Business category is not there in the options Which option should I chosse now ?,question
Business category missing from the options,neutral
Business category missing from the options. What should I do?,question
new companies can also apply?,question
Can I get loan for new enterprise?,question
Can I get loan for new venture,question
Can i get loan for start new business?,question
can i get loan to start new business?,question
Can new businesses also apply for loan?,question
Can new companies apply for loan?,question
I just opened a new business,neutral
I'm a beginner in business,neutral
I'm new in business so I can get loan?,question
I'm planning to start up,neutral
I'm starting business,neutral
I started my business last week,neutral
I started my business started last month,neutral
i started one my company last week,neutral
I starting new firm for business,neutral
I starting new firm for new business,neutral
Its a fresh company,neutral
i want create a business,neutral
i want the money to start a new business,neutral
I want to open a business,neutral
I want to open an enterprise,neutral
I want to start a business.,neutral
I want to start a service,neutral
I want to start a small business can you give me loan?,neutral
I want to start my business so need loan,neutral
I want to start my own enterprise,neutral
Loan available for company less than one year,neutral
Loan available for setting up new business,neutral
Loan for new business?,neutral
Loan give to start business now?,neutral
Loan is available for new businesses?,neutral
My business is new,neutral
My business is relatively new,neutral
my company is started 1 month before,neutral
My company just started months ago,neutral
Need to start own venture,neutral
New business can get loan?,neutral
New businesses can also apply for loans?,neutral
New businesses can get loans?,neutral
Can any fresher apply for loan?,neutral
New company can apply for loan?,neutral
Newly opened company,neutral
New venture can get loan?,neutral
Now starting a new business,neutral
Recently started my company,neutral
Sir I have opened new business,neutral
Started my company last month,neutral
Starting a business now,neutral
Starting a new business,neutral
The business I have is not so old,neutral
The business is relatively new,neutral
To start a business can you give me loan?,neutral
Want to build a new empire,neutral
Want to start a business,neutral
Want to start a business and need loan for that,neutral
Want to start a new venture,neutral
Want to start business needs loan for that,neutral
What to start new business for which I want loan?,neutral
Will you me loan to start my own business?,question
Would like to start a small company. Need loan for that.,question
New in business so can I get loan?,question
Apna business open karna hai sir,neutral
Business start karna hai,neutral
Business shuru karna hai,neutral
this is my first business,neutral
I am starting an online business,neutral
Can a new business get a loan from you?,question
This loan would be good for my business?,neutral
this loan is available to all kinds of business?,neutral
This loan caters to which kind of businesses?,neutral
The types of companies you give loan to,neutral
The loan you give is right for my company?,neutral
The kind of companies you give the loan?,neutral
The categories of company you give the loan to,neutral
Tell me the types of companies to which you give loan,neutral
Tell me the types of companies that can use this loan?,neutral
Tell me the types of companies that can use abcd company direct?,neutral
Tell me the business that I take loan from you?,neutral
Tell me the business that can use this loan?,neutral
Tell me the business that can use abcd company direct?,neutral
Providing loan is available for all kind of biz?,neutral
Only business who can apply for abcd company direct from abcd company?,neutral
Number of companies to give  the loan too,neutral
My business can avail abcd company direct from abcd company?,neutral
My biz can apply for loan?,neutral
Loan you give is to which types of companies?,neutral
Loan will be offered to which types of business?,neutral
Loan is provided to which type of businesses?,neutral
Loan is provided for which businesses?,neutral
loan is given to which firms?,neutral
Loan is given by you for which companies,neutral
loan can used by which business?,neutral
Loan can be taken by me?,neutral
Loan available for business like ours?,neutral
Keep simple tp,neutral
Is this type of loan right for my business?,question
Is this loan right for mine business?,question
Is Loan good for my business?,question
Is abcd company direct right for my business?,question
Is abcd company direct good for my business?,question
Is abcd company direct appropriate for my business?,question
I have a proprietorship. Can I apply?,question
I have a private company. Can I apply?,question
How is abcd company direct right for my business?,question
From you can I take the loan?,neutral
For what type of business this loan is provided?,question
Firms which can apply for this loan?,question
Do you offer loan to business like ours?,question
Can my business take loan from you?,question
Can my business avail abcd company direct?,question
Which business can take loan from you?,question
What types of companies do you give loans to?,question
What types of businesses does your loan caters?,question
What kind of companies use this loan,question
What kind of companies use abcd company direct,question
Can I take the business loan from your company?,question
Can I take the business loan from you?,question
Can I take loan from your company?,question
Can can be taken by any business?,question
Businesses which can avail services of abcd company direct?,neutral
Any business can take this loan?,neutral
abcd company provides loan to which type of business?,neutral
abcd company is for providing loan and is available for all kind of biz?,neutral
abcd company gives loan to which kind to businesses?,neutral
abcd company direct would be suitable for my business?,neutral
abcd company direct will be offered to which types of business?,neutral
abcd company direct is given to which of the businesses?,neutral
abcd company direct is given to what kind of businesses?,neutral
abcd company direct is delivered for what kinds of businesses?,neutral
abcd company direct is available for my business?,neutral
abcd company direct could be used for what type of business?,neutral
abcd company direct caters to what kind of business?,neutral
abcd company direct can used by which business?,neutral
abcd company direct can be used in my business?,neutral
abcd company direct can be used by which of the businesses?,neutral
abcd company direct can be used by business of which types?,neutral
Is this loan give only to firms?,neutral
Can my business apply for abcd company direct?,question
Who can take loan from abcd company?,neutral
this loan give only to business?,question
this loan give only to businesses?,question
this loan give only to companies?,question
What kind of business can take loan from you?,question
Types of companies you give loans to?,neutral
Types of business which can apply for this loan of abcd company?,neutral
Types of business that can have loan from you?,neutral
Types of business that can have loan?,neutral
Types of businesses which can apply for loan from your company?,neutral
Which businesses does this loan caters to?,question
Which type of business can apply for abcd company direct?,question
Which types of business can have loan from you?,question
Who can apply for abcd company direct?,question
Who can take loan from abcd company?,question
You will provide your loan to us?,neutral
Your company gives loan to what kind of businesses?,neutral
You provide loan of which business?,neutral
You give loan to which types of business?,neutral
Would abcd company direct be right for my business,question
Will you give me your loan?,question
To which types of companies do you give loans,question
To which types of businesses do you offer loan?,question
How much amount of money can I have?,question
How much can I borrow and for how long?,question
Amount given for loan?,neutral
Amount I can borrow from this loan?,neutral
Amount I can have as loan?,neutral
Amount I can take as loan?,neutral
Amount of loan that I can take?,neutral
How much loan amount can I get?,question
Amount of money I can take as a loan?,neutral
Amount of money I can take as loan?,neutral
Amount of money I have as loan from abcd company?,neutral
How much loan amount can I take from you?,question
Borrowing limit?,neutral
Borrow limit?,neutral
Can you send me the info about money I can have from this loan?,question
Different loan amounts I can have as loan?,neutral
Final limit of money I can take as a loan?,neutral
For how long can I have your borrowed money?,question
How much amount I can get?,question
Is there any limit on loan I can have?,question
I can have what type of loan amount?,neutral
How much money can I take as loan?,question
How much loan can I get?,question
How much loan can I get ?,question
How much loan amount I can get?,question
How much loan amount can I take as a loan?,question
Amount till which you give loans to busineses?,neutral
As a loan how much loan amount can I take?,question
As a loan how much money can I have?,question
As loan how money can I have?,question
When will I have to give back the loan amount I take from abcd company direct?,question
What si the borrow limit?,question
What loan amount I can get as loan?,question
What is your borrowing limit?,question
What is the total amount I can borrow from this loan?,question
What is the money I can borrow from this loan?,question
What is the loan amount I can take as loan?,question
What is the limit of loan I can have?,question
What is money I Can take as a loan?,question
What is amount you give money to businesses?,question
What are the loan amounts that I can have?,question
What are the different loan amount I can have?,question
What amount of loan I can take from you?,question
Total money I can borrow from your loan?,neutral
Total amount of money I can have from your simplerloan?,neutral
Total amount of money I can have from your abcd company direct?,neutral
Total amount I can borrow from your loan?,neutral
Till what amount do you give loan?,question
Till amount which you give loan to businesses?,question
Tell me the money I can borrow from the loan?,neutral
Tell me the loan amount I can take from you?,neutral
Tell me the limit on loan that I have?,neutral
What is the borrowing limit?,question
Loan amount I can take from you?,neutral
Loan amount I can have?,neutral
Limit of money I can take as loan?,neutral
Need information about the money I can take from simplerloan?,question
Please send information about the amount of money I can have from this loan?,question
Please send information about the money I can have from this loan?,question
Need information about the money I can take from abcd company direct?,question
Need information about the amount I can take from this loan?,question
Need information about the amount I can take from abcd company direct?,question
Need details about how much money I can take from abcd company direct?,question
Need details about how much money I can take?,question
Need details about how much amount I can take from this loan?,question
Need details about how much amount I can take from abcd company direct?,question
Most money I can have as loan?,neutral
Money I can borrow from your company?,neutral
Money I can borrow from this loan?,neutral
Please tell me the amount I can borrow?,neutral
Please tell me the amount I can borrow from abcd company direct?,neutral
Please tell me the amount I can borrow from this loan?,neutral
Please tell me the money I can borrow from abcd company direct?,neutral
Send info about the amount I can have from this loan?,neutral
Send info about the money I can have from this loan?,neutral
Tell me the amount I can borrow from the loan?,neutral
borrow money given can used by me for which purposes?,neutral
Can this borrowed amount be used for business purposes?,question
Can this borrowed amount be used for business reasons?,question
Cases in which abcd company direct would be used be me,neutral
Different objectives I can do with abcd company direct?,neutral
Different purposes this borrowed amount can be used?,neutral
Different purposes this borrowed money can be used?,neutral
Different reasons this borrowed amount can be used?,neutral
Different reasons this borrowed money can be used?,neutral
For what functions can I use abcd company direct?,question
For what functions can I use this loan?,question
For what purposes can I use abcd company direct?,question
For what purposes can I use the borrowed amount?,question
For what purposes can I use the borrow money?,question
Which purposes can this borrowed amount be used for?,question
Which objectives can I fulfill with abcd company direct?,question
Where would I use you this loan?,question
Where would I use you abcd company direct?,question
Where to use abcd company direct money?,question
Where can I use this money from loan?,question
Where can I use this loan?,question
Where can I use the loan money?,question
Where can I use the loan?,question
Where can I used the loaned amount?,question
Where can I use abcd company direct,question
What can I use the money?,question
What can I use the loan money for?,question
What can I use the loan amount for?,question
What can I use the borrowed money for? What can I not use the borrowed money for?,question
What can I use the borrowed money for?,question
What are the various purposes that abcd company direct can be used for?,question
What are the various functions that abcd company direct can be used for?,question
What are the different things where abcd company direct is benificial?,question
What are the different things that abcd company direct can be used for,question
What are the different reasons this borrowed amount is valid?,question
What are the different purposes this borrowed money is valid?,question
What are the different purposes this borrowed amount is valid?,question
What are the different objectives can I fulfill with abcd company direct,question
Various reasons I can use the borrow money?,neutral
Various reasons I can use the borrowed amount?,neutral
Various purposes I can use the borrowed amount?,neutral
Use cases for this loan?,neutral
