Need help pleese,neutral
Need help,neutral
I need some info,neutral
Will you help me?,question
What else can you do?,question
What do you do?,question
What can you help me with?,question
What can you do?,question
What are you good at?,question
Need help plz,question
How can you help me,question
Can you help me?,question
How can you assist?,question
How can you help me?,question
How do you help?,question
How to help you?,question
How will you assist me?,question
i need help,question
Can you tell some info,question
Help me please,question
Is this a bot?,question
Is there a bot chatting to me?,question
Is it automated message?,question
Computer based pely,question
Bot or human?,question
Bot is chatting with me?,question
Are you system generated message?,question
Are you robot?,question
Are you machine?,question
Are you just computer?,question
Are you a robot?,question
Are you a person?,question
Are you a machine?,question
Are you a chatbot?,question
Are you a bot?,question
Are these automated messages?,question
Am I talking to a bot?,question
You are a boy are girl?,question
You are a bot or human?,question
This is a machine?,question
This is a chatbot?,question
System generated reply,neutral
Sir you system genretrd,question
Is this computer based response,question
Is this a machine?,question
Are you a human?,question
Hows life?,question
How was your day?,question
How you doin?,question
Whats up?,question
What's happening?,question
Kya chal raha?,question
Wassup?,question
How you doing?,question
Are you fine?,question
Are you good?,question
How are you?,question
How are you doing?,question
Only providing my number,neutral
Only providing my email,neutral
Only providing my contact details,neutral
Only here to give my contact,neutral
i am just here to provide my number,neutral
i am just here to provide my details,neutral
Who are youu?,question
What can I call you?,question
Your name?,question
Can you tell me your name?,question
Are you there?,question
Any one there?,question
What is your name?,question
are you abir?,question
Is anyone there?,question
Your name is?,question
Who is chatting?,question
Tell me about your self?,question
Who are you?,question
Who am I chatting with?,question
What's your name?,question
What should I say as your name?,question
Tell me your name?,question
What are you called?,question
No I will not give the information.,neutral
No. Cannot give you.,neutral
I don't want to tell,neutral
I don't want to,neutral
I don't think so,neutral
Don't have it as of now.,neutral
Cannot tell you,neutral
Won't tell,neutral
Won't give you,neutral
Sorry but I won't,neutral
Right now I don't have it.,neutral
I have a question,neutral
Need to aska query,neutral
I have a question for you,neutral
HAving a query,neutral
I have a query for you,question
I have a query,question
Have a query for you,question
Wait for two minutes,neutral
will you please wait,neutral
Can you  please wait,neutral
Please wait,neutral
Wait for some time,neutral
Want you to wait for me,neutral
Can you wait for two minutes,neutral
Connect me to the support of abcd company,neutral
I want a call back from you,neutral
Please tell me your tollfree number ?,question
Please tell me your mobile number?,question
Address of your company?,question
Address of abcd company?,question
How to reach out to abcd company team?,question
How to get in touch with your team?,question
Your team can be reached how?,question
Your helpline number?,question
Your company's address?,question
How to meet you,question
Your email address to reach?,question
You have any branch at kolkata?,question
How contact representative?,question
How do i contact you?,question
How to get in touch with the your team?,question
How to contact you?,question
What is your helpline number?,question
Which number I should call to reach you?,question
Which number can I call to discuss?,question
Which email should I use to reach to you?,question
Which email I must use to reach to you?,question
Give me your number need to speak,neutral
Give me your mobile no,neutral
Give me the mobile number and i will call you,neutral
Email I must use to co-ordinate with you,neutral
Getting in touch,neutral
I need help. Connect me with support.,question
Need a telephonic call,neutral
Need a person to chat with me,neutral
Need human agent,neutral
Need customer care,neutral
Guide me please regarding the loan?,question
Contact me on my personal number 9999999999,neutral
Did not solved my query,neutral
Contact me please,neutral
Guide me please,neutral
Call me later,neutral
Call me at my phone number?,question
999999999 call me now,neutral
arrange call for me,neutral
call me at my number,neutral
Should I get a call back tomorrow?,question
Can I call tomorrow?,question
Contact me at my mobile number,neutral
Call on the mobile number 9999999999,neutral
Call on my phone number 9999999999,neutral
Contact me at my phone number,neutral
Call on 9999999999 now,neutral
Please get me human to solve my query?,question
Please call me on my number,neutral
Want a person to chat,neutral
Please contact me now,neutral
Call me on my number,neutral
Want to chat with a person,neutral
What is your email ID?,question
Need to speak to an executive,neutral
Need to get in touch with the your team?,question
Need to contact customer care.,neutral
Need to contact customer care agent.,neutral
Need to contact customer care executive,neutral
Need to contact customer care agent now please,neutral
In which number should I reach to you?,question
In which number can I reach your team?,question
In which email to reach you?,question
How to reach you ?,question
can i meet any one in bank?,question
Can I please contact customer care?,question
can u tell me your Email id ?,question
Can you provide executive number help,neutral
Can you share the contact details of the support,neutral
Need to contact you guys,neutral
Need to get in touch with the Simpler Loan team?,neutral
can i get phone number of your company,neutral
Can I get a telephonic call?,question
I wan to speak to executive,neutral
Is it possible to meet any one in bank,neutral
I want to speak with you,neutral
I want to contact concerned people.,neutral
I want to contact your team,neutral
I want to tak to you,neutral
I want to talk to customer care executive,neutral
How to reach out to your team?,question
Email I can use to reach you?,question
Do you have any branch?,question
Customer support?,question
Customer service?,question
Please call me at my number,neutral
No answering correctly,neutral
Need to contact your team,neutral
Need to contact human,neutral
How to get in touch with customer service?,question
What is your customer care no. ?,question
Number I can call to discuss,neutral
What is your toll free number,neutral
What's the Email ID of abcd company,neutral
Where are your branches?,question
Where is your office located?,question
Where is your office?,question
Kindle send you are mobile no or email IDentification,neutral
i wish to talk with representative,neutral
Kindly send you are customer care no,neutral
Let me speak with an executive,neutral
Need to contact concerned persons,neutral
Want to meet your executive,neutral
want to talk to executive,neutral
What are the customer care contact?,question
What is email ID of your company?,question
What is the toll free number of abcd company,neutral
What is the toll free number,neutral
What is the nearest branch?,question
What is the email address to reach you?,question
How can the the your team be reached?,question
How can the abcd company team be reached?,question
How can I speak to an executive,question
How can I reach your team for a query?,question
How can I contact you?,question
Give your contact number.,neutral
abcd company team can be reached how?,question
abcd company email address?,question
abcd company office is located where?,question
Any branch at delhi?,question
Want to meet the executive for loan information,neutral
Want to communicate. So give me your number,neutral
To reach you which email address?,question
Tell me the number in which I could reach?,question
Please send you are number,neutral
Please provide phone no.,neutral
Please provide me the to contact person,neutral
Pease tell mobile number. I need to speak,neutral
Please provide me the real person,neutral
Please give your mobile no or email ID,neutral
Number to reach you,neutral
Need to chat with human,neutral
i want to know your office address in punjab?,question
Lost Aadhaar,neutral
I currently don't have Aadhaar card What can I do?,question
I do not have aadhaar card can I apply for loan,neutral
i do not have addhar card can I get loan,neutral
I do not have an Aadhaar Card. What should I do?,question
If Aadhaar card goes missing would I be able to give my application?,question
If my Aadhaar card is lost can I still submit my application?,question
I lost my aadhaar can I still apply?,question
Is Aadhaar card mandatory for filling the loan application?,question
Is it compulsory to give Aadhaar card for the sanction of this loan?,question
Is it mandatory to give Aadhaar card for loan?,question
No Aadhaar,neutral
No Aadhaar. Can I apply?,question
No aadhaar. Can I still get the loan?,question
No aadhaar here. Can I still get a loan?,question
No aadhaar here. Can I submit application?,question
Not having aadhaar. What to do?,question
Without the aadhaar get I still get loan?,question
Without having Aadhaar card can I submit my application?,question
What should I do if i don't have Aadhaar card?,question
What can I do if I lost Aadhaar card?,question
What can I do if I don't have Aadhaar card?,question
What are my options if I don't have the  Aadhaar card?,question
Tell me can you give me a loan without the Aadhaar card?,question
Aadhaar card is lost can I still submit my application?,question
Aadhaar card is missing.,neutral
Aadhaar card is missing What to do?,question
Aadhaar is lost what else can I do?,question
can I apply for loan even if I do not have addhar card?,question
Can I apply without having Aadhaar card?,question
Can I get loan without the Aadhaar card?,question
Can I still get loan even without aadhaar?,question
Can I submit my application even if I dont have Aadhaar card,question
Don't have Aadhaar card Tell me what should I do?,question
How to get loan without Aadhaar card?,question
What address proof can I provide?,question
Types of address proofs I can give?,question
The types of proofs of address. Which I can give.,question
The proofs of address that I need to submit.,neutral
The business address proofs I can upload in the application?,neutral
The bills to be uploaded for proving the address?,neutral
The address proofs that can be uploaded in application?,neutral
The address proofs that are needed in this application?,neutral
Need to provide which address proofs?,question
In application which address proofs can be uploaded?,question
For proving the address what is the proofs I can upload?,question
For proving my address what address I need to give?,question
For proof of my address which bills do you need?,question
For address proof what bills can I upload?,question
For address proof what bills can Igive?,question
The personal address information I can upload in the application?,question
personal address proofs I'll have to provide?,question
personal address proofs I need to give?,question
personal address proofs I need to upload?,question
Please tell me what are different personal address proofs I can upload in this application?,question
Personal proofs to be added in application?,neutral
Personal proofs added on application?,neutral
Tell me what are the personal address proofs I can upload in the application?,question
Which personal address proofs can I upload in the application?,question
What types of personal address proofs can I provide?,question
What types of personal address information can I upload as part of the application?,question
What personal address can I give for my address,question
What are the personal address proofs I can upload in the application?,question
The personal address proofs I can upload in the application?,neutral
Address information I can upload in the application?,neutral
Address proof I have to provide,neutral
Address proofs I can upload in the application?,neutral
Address proofs I'll have to provide?,neutral
Address proofs I need to give?,neutral
Address proofs I need to upload?,neutral
Bills for proof of address?,neutral
Bills I can give for address proof?,neutral
Bills I can upload for proof of my address?,neutral
Bills that I can give for the address proof?,neutral
Bills to give for proof of address?,neutral
Bills to give for proving the address,neutral
Bills you need to address proof?,neutral
personal address proofs can I give in the application?,neutral
personal address information I can upload in the application?,neutral
For the application what are the personal adresss information I can upload?,question
Different personal address proofs I can upload in this loan application?,question
In loan application what are diifferent personal address proofs ?,question
home or personal address proofs can I upload as part of the application?,neutral
For the application what are the personal adresss proofs I can upload?,neutral
Which address proof should I give to you?,question
Which address proofs do I need to provide?,question
Which address proofs do I need to give?,question
Which address proof do you need from me?,question
What to upload for proving my address?,question
what bills to give for address proof?,question
What are the types of address proofs I need to give?,question
What address proofs are accepted?,question
Types of address proofs that can be uploaded?,question
Personal address proofs can I provide in loan application?,question
Process of application process for getiing the loan?,neutral
Process of abcd company direct applying?,neutral
Process of abcd company direct application process for getiing the loan?,neutral
Process of abcd company direct application?,neutral
Process for applying for this loan?,neutral
Process for applying for abcd company direct?,neutral
Procedure to take loan?,neutral
Procedure to have finance?,neutral
procedure to get finance for business?,neutral
procedure to get finance?,neutral
Procedure to apply for loan?,neutral
procedure of this loan application procedure for getiing the loan?,neutral
Please tell How can I apply for abcd company direct?,question
Please tell me the process for getting the loan?,question
Please tell me the process in order to apply for abcd company direct?,question
Please tell me the ways for applying for abcd company direct?,question
procedure of abcd company direct application procedure for getting the loan?,neutral
Procedure for loan sanction,neutral
procedure for applying for simplerloan?,neutral
procedure for applying for abcd company direct?,neutral
Please tell the process of abcd company direct application to get loan?,question
Please tell the process for registering abcd company direct?,question
Please tell the process for applying this loan?,question
Please tell the process for applying abcd company direct?,question
Please tell the procedure of this loan application to get loan?,question
Please tell the procedure of application to get loan?,question
Please tell the procedure of abcd company direct application to get loan?,question
Can you please tell me the process of abcd company direct application?,question
Can you please tell me what are the ways to apply for abcd company direct?,question
Can you please tell me what are the ways to register for abcd company direct?,question
For sanction of loan what is the process?,question
For taking the loan what is the process?,question
For the loan requirement what is the process?,question
Guide me the loan process,neutral
Please tell the procedure for applying abcd company direct?,question
Please tell me the ways for registering for abcd company direct?,question
Can you please tell me the procedure of this loan application?,question
I want Business loan for amount 2 lacks how can I proceed?,question
I want Business loan for amount 2 lacks how to proceed?,question
Would like to know how can I get loan?,question
With the process of loan please guide me,neutral
Where can I register for a abcd company direct?,question
Where can I apply for a abcd company direct?,question
this loan moblie application process?,neutral
To get loan how to I sign up?,question
how to get loan,question
How to fill the loan application,question
How to fill the application?,question
How to do the loan application?,question
How to apply for loan ?,question
how to apply for loan,question
How to apply for business loan?,question
How to apply for abcd company direct loan?,question
How to apply?,question
How I will get loan?,question
How is the process to apply for this loan?,question
I want to know the procedure for loan,neutral
Can you please tell me the procedure of application?,question
Can you please tell me process for the loan?,question
Can you please tell me about process of abcd company direct application?,question
Can you please tell me about procedure of abcd company direct application?,question
CAn I get your application form?,question
As I want a new loan what is the procedure for that?,question
abcd company direct registering process?,neutral
abcd company direct online applying process?,neutral
abcd company direct online applying procedure?,neutral
abcd company direct moblie application process?,neutral
abcd company direct moblie application procedure?,neutral
abcd company direct applying process?,neutral
abcd company direct applying procedure?,neutral
abcd company direct applying how?,neutral
abcd company direct apply,neutral
abcd company direct application process?,neutral
abcd company direct application procedure?,neutral
How do I proceed for loan,question
How to proceed for loan,question
How should I proceed for loan?,question
I want to know how does this application work?,neutral
I want loan what's the process?,neutral
I need to know what is process of loan for a new business,question
I need loan tell me the process?,neutral
I need loan so what is the process?,question
I need a loan. How to get it??,question
I have a business what is the paper work for taking this loan facility?,question
How would one apply for abcd company direct?,question
How will I get loan?,question
What's the abcd company direct applying procedure for taking the loan?,question
What's the abcd company direct applying process for taking the loan?,question
What's the applying process for the loan?,question
What's the loan process?,question
Whats the loan process?,question
What's the procedure for applying abcd company direct?,question
What's the procedure for registering abcd company direct?,question
What's the procedure to start new businesses?,question
What's the process for applying this loan?,question
What's the process for registering abcd company direct?,question
What to do for loan application?,question
Help me with the loan procedure,neutral
Guide me through the process of loan?,neutral
How apply for abcd company direct loan?,question
How will get loan,question
How to start application for loan?,question
How to I sign up to get the loan,question
How to I sign up for the process of loan,question
Can you please tell me the process?,question
To get this loan ewhta is the procss?,question
want to know how is the application process?,question
Want to know procedure for loan?,neutral
Want to know the application procedure,neutral
want to know the procedure for application,neutral
Want to know the procedure of this loan?,neutral
Want to know the process of loan application,neutral
Want to know the process to start new business,neutral
What are steps to get the loan?,neutral
How to I sign up for the loan,question
How to I sign up,question
How to get the loan?,question
What's the process for applying abcd company direct?,question
What are the details to apply for the loan?,question
What are the ways to apply for abcd company direct?,question
What are the ways to register for abcd company direct?,question
What is Loan procedure?,question
What is the application process?,question
What is the applying process?,question
What is the procedure for this loan?,question
What is the procedure to get finance,question
What is the process and paper work for taking this loan?,question
What is the process for getting finance?,question
What is the process for getting the loan?,question
What is the process for the sanction of loan?,question
What is the process of applying for abcd company direct?,question
What is the process of applying for this loan?,question
What is the process of registering for abcd company direct?,question
What is the process of taking the loan?,question
What is the process to apply for abcd company direct?,question
What is the process to apply for simplerloan?,question
What is the process to get finance?,question
What is the process to start new business?,question
What is your application process?,question
What is your loan process?,question
What is your process of application?,question
What's the abcd company direct application procedure for taking the loan?,question
What's the abcd company direct application process for taking the loan?,question
How is the process to apply for abcd company direct?,question
How is the procedure to apply for abcd company direct?,question
How is the possible to take loan?,question
How is it possible to get loan?,question
How I can get the loan?,question
How getting loan?,question
How get loan?,question
How do I applying for abcd company direct?,question
How do I apply for loan?,question
How do I apply?,question
How can I take loan from your company?,question
How can I have a business loan?,question
How can I get the loan please tell me the process,question
How can I get It Please Tell me for process,question
How can I get a loan from you?,question
How can I fill the loan application?,question
How can I apply for the business loan?,question
How can I apply for loan?,question
how can I apply for loan,question
How can I apply for abcd company direct?,question
How can get loan,question
The process of abcd company direct applying to get loan?,neutral
The process of abcd company direct application to get loan?,neutral
The procedure of this loan application to get loan?,neutral
The procedure of simplerloan application to get loan?,neutral
The procedure of abcd company direct applying to get loan?,neutral
The procedure of abcd company direct application to get loan?,neutral
Tell me the process to get this loan?,neutral
Tell me the process of abcd company direct application ?,neutral
Tell me the process for applying for this loan?,neutral
Tell me the procedure of this loan application?,neutral
Tell me the procedure of abcd company direct application ?,neutral
tell me the procedure for applciation,neutral
Tell me about the process to apply for simplerloan?,neutral
Tell me about the process to apply for abcd company direct?,neutral
Steps to get the loan,neutral
Steps for availing the loan,neutral
Send me your application form,neutral
Process to get loan for business?,neutral
Process to get business loan?,neutral
Process to apply for loan?,neutral
Process to apply?,neutral
Process of abcd company direct applying process for getiing the loan?,neutral
Need offline application form,neutral
Need the details to apply for loan?,neutral
Need the process for loan,neutral
need to know the loan process,neutral
Need your application form,neutral
please guide me the with procedure of the loan?,neutral
Please send application form,neutral
I want to know what is process of loan for a new business,question
I would like to know the process of application,question
I would like to know the process of loan,question
loan application procedure?,neutral
Loan applying process?,neutral
Loan apply karna hai,neutral
Mobile app abcd company direct applying procedure?,neutral
Mobile app loan applying procedure?,neutral
Nedd help with loan procedure,neutral
Need loan so how is it possible?,question
What is process for enrolling for sodexo pass?,question
Give me the application process,neutral
How will I create a new account?,question
How do I enroll for a meal pass?,question
How to sign up?,question
How do I register?,question
Can you please tell me the process of sodexo pass application?,question
Can you please tell me the process?,question
Can you please tell me the procedure of this pass application?,question
Can you please tell me the procedure of application?,question
Sodexo meal pass registering process?,neutral
Sodexo pass online applying process?,neutral
Sodexo pass online applying procedure?,neutral
Apply through mobile or website?,neutral
Sodexo moblie application procedure?,neutral
Sodexo applying process?,neutral
Sodexo applying procedure?,neutral
Sodexo pass applying how?,neutral
Sodexo pass apply,neutral
Sodexo pass application process?,neutral
Sodexo pass application procedure?,neutral
How should I proceed for pass?,question
How do I proceed for meal pass,question
How to proceed for pass,question
What is the process for getting the pass?,question
Need a new meal pass how to apply,question
New pass needed,neutral
How to apply for a new pass,question
How to register for a new meal pass,question
How to apply for meal pass?,question
Process for registration,neutral
